{"type":"config","name":"Solmu graph performance optimization","metricName":"total_ms","metricUnit":"ms","bestDirection":"lower"}
{"run":1,"commit":"f4f0276","metric":106.21,"metrics":{"cycle_large_ms":82.13,"cycle_medium_ms":22.67,"cycle_small_ms":1.41,"route_large_ms":74.45,"route_medium_ms":18.14,"lookup_large_ms":5.21,"grid_dots_ms":0.06,"bounds_large_ms":0.08},"status":"keep","description":"Baseline: 106ms total. Large graph routing dominates at 74ms. Node lookups 5ms.","timestamp":1774735213016,"segment":0,"confidence":null,"iterationTokens":3302,"asi":{"hypothesis":"Baseline measurement","bottleneck":"A* routing is 90% of cost. Large graph: 74ms routing out of 82ms cycle. Priority queue + obstacle lookup optimization should be highest impact."}}
{"run":2,"commit":"7b9ed6a","metric":104.24,"metrics":{"cycle_large_ms":79.84,"cycle_medium_ms":22.85,"cycle_small_ms":1.55,"route_large_ms":89.33,"route_medium_ms":20.52,"lookup_large_ms":5.11,"grid_dots_ms":0.06,"bounds_large_ms":0.08},"status":"keep","description":"Binary heap for A* open set + gScores map. Small improvement in cycle times (82→80ms large).","timestamp":1774735276516,"segment":0,"confidence":null,"iterationTokens":5784,"asi":{"hypothesis":"Binary heap reduces O(n log n) sort to O(log n) extraction","finding":"Cycle time improved slightly but route_large went up - the gScores Map adds overhead. Main bottleneck is isBlocked/isPathBlocked linear scan through obstacles, called thousands of times per A* run.","next_action_hint":"Most edges in grid have direct clear path (neighbors), but isPathBlocked still scans all obstacles. Need spatial indexing for obstacle checks OR early-exit optimization."}}
{"run":3,"commit":"850ed8f","metric":14.63,"metrics":{"cycle_large_ms":9.45,"cycle_medium_ms":4.63,"cycle_small_ms":0.55,"route_large_ms":3.25,"route_medium_ms":1.89,"lookup_large_ms":5.08,"grid_dots_ms":0.08,"bounds_large_ms":0.1},"status":"keep","description":"Spatial hash grid for obstacle lookups. 106→14.6ms (7.3x speedup). Large routing 74→3.25ms.","timestamp":1774735408889,"segment":0,"confidence":46.48730964467008,"iterationTokens":13145,"asi":{"hypothesis":"Spatial hash grid turns O(n) obstacle checks into O(1) amortized","finding":"Massive 7.3x improvement. Routing went from dominant cost to secondary. Now lookup_large (5ms) is comparable to cycle_large (9.45ms), meaning node.find() is a significant fraction of remaining cost.","next_action_hint":"Use Map for node lookups in benchFullCycle instead of array.find(). Also optimize useSolmu to use Map."}}
{"run":4,"commit":"fff2d8b","metric":5.45,"metrics":{"cycle_large_ms":3.35,"cycle_medium_ms":1.71,"cycle_small_ms":0.39,"route_large_ms":3.29,"route_medium_ms":2.02,"lookup_large_ms":5.1,"grid_dots_ms":0.07,"bounds_large_ms":0.1},"status":"keep","description":"Node Map for O(1) lookups + spatial grid in useSolmu. 14.6→5.45ms. Eliminated per-edge obstacle filter array allocation.","timestamp":1774735465856,"segment":0,"confidence":2.200480454247652,"iterationTokens":3766,"asi":{"hypothesis":"Map lookup O(1) vs array.find O(n) per edge","finding":"14.6→5.45ms, another 2.7x. cycle_large down from 9.45 to 3.35ms. Now route_large (3.29ms) is close to cycle_large (3.35ms) — most cycle time IS routing now. lookup_large still 5ms (separate bench, not optimized yet).","next_action_hint":"Look at reducing allocations in A* (object creation), string key generation. Also isSegmentBlocked creates Set per call."}}
{"run":5,"commit":"f48949d","metric":5.43,"metrics":{"cycle_large_ms":3.33,"cycle_medium_ms":1.69,"cycle_small_ms":0.4,"route_large_ms":3.27,"route_medium_ms":1.92,"lookup_large_ms":5.33,"grid_dots_ms":0.08,"bounds_large_ms":0.1},"status":"keep","description":"Generation counter replaces Set in isSegmentBlocked. 5.45→5.43ms (within noise but avoids GC pressure).","timestamp":1774735503562,"segment":0,"confidence":10.954347826086956,"iterationTokens":2748,"asi":{"hypothesis":"Replace per-call Set with generation counter in isSegmentBlocked","finding":"Marginal improvement. Most A* calls resolve via the direct-path check at the top and never enter the main loop. The remaining time is in path simplification, SVG string building, and the overhead of building maps/grids.","next_action_hint":"Profile where time goes in cycle: is it the Map construction, grid construction, or routing itself? Could try reducing string allocations in SVG path building."}}
{"run":6,"commit":"f5c0347","metric":5.3,"metrics":{"cycle_large_ms":3.25,"cycle_medium_ms":1.66,"cycle_small_ms":0.38,"route_large_ms":3.43,"route_medium_ms":1.82,"lookup_large_ms":5.48,"grid_dots_ms":0.08,"bounds_large_ms":0.02},"status":"keep","description":"Optimize getNodeBounds (avoid temp arrays), SVG path array join, avoid per-edge config spread. 5.43→5.30ms.","timestamp":1774735569669,"segment":0,"confidence":21.58502673796791,"iterationTokens":5881,"asi":{"hypothesis":"Reduce allocations in getNodeBounds, SVG path building, and per-edge config spread","finding":"bounds_large 5x faster (0.10→0.02ms). Total improved marginally. The remaining 3.25ms cycle_large is dominated by calculateRoute calls, which for adjacent nodes mostly just do the direct-path-clear check.","next_action_hint":"Try connector lookup optimization (build connector map per node), or optimize the direct-path check in SpatialGrid. Also consider if simplifyPath/snapToAxis adds overhead for the common 2-point path case."}}
{"run":7,"commit":"f5c0347","metric":5.4,"metrics":{"cycle_large_ms":3.43,"cycle_medium_ms":1.61,"cycle_small_ms":0.36,"route_large_ms":3.47,"route_medium_ms":1.59,"lookup_large_ms":5.36,"grid_dots_ms":0.09,"bounds_large_ms":0.02},"status":"discard","description":"Fast path for 2-point direct routes. No improvement (5.30→5.40ms, within noise but slightly worse).","timestamp":1774735621321,"segment":0,"confidence":672.7333333333318,"iterationTokens":5357,"asi":{"hypothesis":"Skip simplifyPath/orthogonalizePoints for 2-point direct paths","rollback_reason":"No improvement - the 2-point case already exits early from simplifyPath/orthogonalizePoints. The overhead is elsewhere.","next_action_hint":"Profile more precisely. The 3.25ms cycle_large includes: ~0.02ms bounds + spatial grid construction + 1740 * (node lookup + connector find + calculateRoute + segment computation). Try reducing midpointOfPolyline/endpointLabelPoints allocations, or optimize the spatial grid cell lookup."}}
{"run":8,"commit":"a175ea3","metric":5.02,"metrics":{"cycle_large_ms":3.07,"cycle_medium_ms":1.55,"cycle_small_ms":0.4,"route_large_ms":3.03,"route_medium_ms":1.57,"lookup_large_ms":5.21,"grid_dots_ms":0.07,"bounds_large_ms":0.02},"status":"keep","description":"Numeric hash keys for spatial grid (avoid string allocation). 5.30→5.02ms.","timestamp":1774735667582,"segment":0,"confidence":361.3928571428574,"iterationTokens":4162,"asi":{"hypothesis":"Numeric hash keys avoid string allocation in spatial grid lookups","finding":"5.3→5.02ms (~5% improvement). route_large 3.43→3.03ms. Still dominated by per-edge overhead: calculateRoute invocation, midpointOfPolyline, endpointLabelPoints, SVG path string generation.","next_action_hint":"Try inlining the direct-path result construction for the common 2-point case to reduce function call overhead. Or pre-compute connector positions per node."}}
{"run":9,"commit":"02230d5","metric":4.43,"metrics":{"cycle_large_ms":2.73,"cycle_medium_ms":1.37,"cycle_small_ms":0.34,"route_large_ms":2.63,"route_medium_ms":1.46,"lookup_large_ms":5.15,"grid_dots_ms":0.08,"bounds_large_ms":0.02},"status":"keep","description":"Numeric hash keys for A* closedSet and gScores. 5.02→4.43ms (12% improvement).","timestamp":1774735691574,"segment":0,"confidence":248.2439024390243,"iterationTokens":1637,"asi":{"hypothesis":"Replace string keys with numeric hash in A* closedSet/gScores","finding":"4.43ms total. route_large 3.03→2.63ms. String→number keys consistently help across all map/set usages. We're now at 24x faster than baseline.","next_action_hint":"For the cycle benchmark: spatial grid construction happens every render. Could try caching it. Also midpointOfPolyline creates objects per call. Or try reducing object allocations in calculateRoute for the 2-point direct path."}}
{"run":10,"commit":"a2a0d89","metric":2.89,"metrics":{"cycle_large_ms":1.7,"cycle_medium_ms":0.93,"cycle_small_ms":0.26,"route_large_ms":1.53,"route_medium_ms":1.22,"lookup_large_ms":5.68,"grid_dots_ms":0.06,"bounds_large_ms":0.02},"status":"keep","description":"Inline fast path for 2-point direct routes (skip simplify/midpoint/endpoint overhead). 4.43→2.89ms (35% improvement, 37x from baseline).","timestamp":1774735736844,"segment":0,"confidence":149.7391304347825,"iterationTokens":3859,"asi":{"hypothesis":"Inline label/path computation for 2-point case to avoid function call overhead + object allocations","finding":"2.89ms total (37x from baseline). cycle_large 2.73→1.70ms. route_large 2.63→1.53ms. The remaining 1.70ms for 1740 edges is ~1µs per edge. Getting close to V8 overhead floor.","next_action_hint":"Try: 1) Avoid allocating new Point objects in isSegmentBlocked (p1/p2 creation), 2) Pre-build connector lookup maps per node, 3) Try simpleOrthogonalRoute before A* for cases where no obstacles in bounding box."}}
{"run":11,"commit":"a2a0d89","metric":3.4,"metrics":{"cycle_large_ms":2.17,"cycle_medium_ms":1.02,"cycle_small_ms":0.21,"route_large_ms":1.74,"route_medium_ms":1.37,"lookup_large_ms":5.37,"grid_dots_ms":0.06,"bounds_large_ms":0.01},"status":"discard","description":"Zero-allocation lineIntersectsRectXY + segIntersectXY. Regressed 2.89→3.40ms. V8 may not inline large functions.","timestamp":1774735798713,"segment":0,"confidence":106.5154639175257,"iterationTokens":5900,"asi":{"hypothesis":"Avoid object allocation in lineIntersectsRect by passing raw coordinates","rollback_reason":"Regressed. The coordinate-passing approach likely exceeds V8's inlining heuristic (too many parameters). The existing Point-based approach is actually fine because V8 can optimize small short-lived objects with escape analysis.","next_action_hint":"Try smaller optimizations: reduce allocations in isSegmentBlocked (reuse Point objects), or optimize the SpatialGrid cell size. Also try connector pre-indexing."}}
{"run":12,"commit":"a2a0d89","metric":3.8,"metrics":{"cycle_large_ms":2.64,"cycle_medium_ms":0.95,"cycle_small_ms":0.21,"route_large_ms":1.56,"route_medium_ms":1.29,"lookup_large_ms":5.1,"grid_dots_ms":0.06,"bounds_large_ms":0.01},"status":"discard","description":"Skip segment check in A* for single-step moves. Regressed 2.89→3.80ms (invalid paths cause longer A* searches).","timestamp":1774735871291,"segment":0,"confidence":83.65991902834008,"iterationTokens":4202,"asi":{"hypothesis":"Skip isSegmentBlocked in A* - isPointBlocked alone should suffice for small steps","rollback_reason":"Regressed badly. Without segment check, paths can clip obstacle corners causing longer detours and more A* iterations. The segment check catches diagonal cuts through obstacle margins.","next_action_hint":"Try: pre-compute connector positions into a lookup map per node. Or optimize spatial grid cell size. Or reduce object allocations in the hot isSegmentBlocked path."}}
{"run":13,"commit":"a2a0d89","metric":3.1,"metrics":{"cycle_large_ms":1.89,"cycle_medium_ms":0.99,"cycle_small_ms":0.23,"route_large_ms":1.62,"route_medium_ms":1.53,"lookup_large_ms":5.17,"grid_dots_ms":0.06,"bounds_large_ms":0.03},"status":"discard","description":"Cell size benchmark - 20 is already optimal. No change to commit.","timestamp":1774735918137,"segment":0,"confidence":68.88,"iterationTokens":1902,"asi":{"hypothesis":"Test different spatial grid cell sizes","rollback_reason":"cellSize=20 already optimal. No code change needed.","finding":"cellSize 5: 4.65ms, 10: 1.58ms, 15: 1.81ms, 20: 1.41ms, 30: 1.67ms, 40: 1.72ms"}}
{"run":14,"commit":"a2a0d89","metric":4.29,"metrics":{"cycle_large_ms":2.77,"cycle_medium_ms":1.26,"cycle_small_ms":0.26,"route_large_ms":1.54,"route_medium_ms":1.15,"lookup_large_ms":5.25,"grid_dots_ms":0.06,"bounds_large_ms":0.02},"status":"discard","description":"Connector pre-index map + path reverse. Regressed 2.89→4.29ms (map construction cost > savings for 4 connectors).","timestamp":1774735958472,"segment":0,"confidence":92.66367713004482,"iterationTokens":3987,"asi":{"hypothesis":"Pre-build connector map + use push/reverse for A* path","rollback_reason":"Connector map string key creation overhead exceeds benefit for 4 connectors/node. push/reverse was neutral (A* rarely runs since most paths are direct).","next_action_hint":"Try just the path reverse optimization alone. Or try reducing the spatial grid construction time. Or try a completely different approach: reduce number of edges that need routing."}}
{"run":15,"commit":"a2a0d89","metric":3.72,"metrics":{"cycle_large_ms":2.26,"cycle_medium_ms":1.22,"cycle_small_ms":0.23,"route_large_ms":1.56,"route_medium_ms":1.2,"lookup_large_ms":5.09,"grid_dots_ms":0.06,"bounds_large_ms":0.01},"status":"discard","description":"Move direct-path check before grid snapping. Regressed 2.89→3.72ms (V8 optimization sensitivity).","timestamp":1774735992843,"segment":0,"confidence":84.68852459016395,"iterationTokens":2549,"asi":{"hypothesis":"Skip gridStart/gridEnd object creation for direct paths","rollback_reason":"Regressed - V8 JIT is sensitive to function shape changes. Moving code around in hot functions can cause deoptimization.","next_action_hint":"Focus on higher-level optimizations: reduce iteration count, skip unnecessary work. Try increasing benchmark iterations for more stable measurements."}}
{"run":16,"commit":"a2a0d89","metric":2.95,"metrics":{"cycle_large_ms":1.69,"cycle_medium_ms":1.04,"cycle_small_ms":0.21,"route_large_ms":1.54,"route_medium_ms":0.95,"lookup_large_ms":5.22,"grid_dots_ms":0.06,"bounds_large_ms":0.02},"status":"discard","description":"Single-cell fast path in isSegmentBlocked. No clear improvement (2.89→2.95ms, high variance).","timestamp":1774736055499,"segment":0,"confidence":107.06735751295341,"iterationTokens":478,"asi":{"hypothesis":"Fast path for single-cell segment checks (skip dedup, min/max)","rollback_reason":"Within noise, not clearly better. The branch cost may offset savings.","next_action_hint":"At ~2.9ms we're close to V8 overhead floor. Try reducing benchmark noise with more iterations. Or look at completely different optimizations: SVG path string caching, reduce allocations in calculateRoute return value."}}
{"run":17,"commit":"a2a0d89","metric":3.68,"metrics":{"cycle_large_ms":2.46,"cycle_medium_ms":1.01,"cycle_small_ms":0.21,"route_large_ms":1.53,"route_medium_ms":1.19,"lookup_large_ms":5.23,"grid_dots_ms":0.07,"bounds_large_ms":0.02},"status":"discard","description":"Avoid sqrt in simplifyPath collinearity check. Regressed 2.89→3.68ms (simplifyPath rarely runs for direct paths).","timestamp":1774736096618,"segment":0,"confidence":103.32,"iterationTokens":2671,"asi":{"hypothesis":"Avoid sqrt in simplifyPath using squared comparison","rollback_reason":"Regressed. simplifyPath is rarely called (most paths are 2-point direct). Function shape change likely caused V8 deopt.","next_action_hint":"Micro-optimizations in routing.ts are hitting diminishing returns at ~2.9ms. Focus on useSolmu-level optimizations or try broader architectural changes."}}
{"run":18,"commit":"a2a0d89","metric":3.95,"metrics":{"cycle_large_ms":2.77,"cycle_medium_ms":0.98,"cycle_small_ms":0.2,"route_large_ms":1.61,"route_medium_ms":1.19,"lookup_large_ms":5.36,"grid_dots_ms":0.08,"bounds_large_ms":0.01},"status":"discard","description":"Revert SVG path to string concat. Regressed 2.89→3.95ms (array.join was better).","timestamp":1774736125451,"segment":0,"confidence":103.31999999999996,"iterationTokens":2219,"asi":{"hypothesis":"String concat vs array.join for SVG path building","rollback_reason":"array.join is faster than string concat for SVG paths","next_action_hint":"Micro-opts exhausted at ~2.9ms. Focus on useSolmu architectural changes or try larger-graph benchmarks."}}
{"run":19,"commit":"a2a0d89","metric":4.15,"metrics":{"cycle_large_ms":3.03,"cycle_medium_ms":0.91,"cycle_small_ms":0.21,"route_large_ms":1.58,"route_medium_ms":1.4,"lookup_large_ms":5.1,"grid_dots_ms":0.07,"bounds_large_ms":0.02},"status":"discard","description":"Added xlarge benchmark (2500 nodes, 4900 edges). 5.27ms cycle. Noisy total due to xlarge warmup.","timestamp":1774736173956,"segment":0,"confidence":102.2970297029703,"iterationTokens":2183,"asi":{"hypothesis":"Add 2500-node benchmark","rollback_reason":"Discarding because it adds noise to primary metric","finding":"xlarge (2500 nodes) = 5.27ms/cycle. Linear scaling confirmed."}}
{"run":20,"commit":"a2a0d89","metric":3.48,"metrics":{"cycle_large_ms":2.27,"cycle_medium_ms":1,"cycle_small_ms":0.2,"route_large_ms":1.54,"route_medium_ms":1.23,"lookup_large_ms":5.27,"grid_dots_ms":0.07,"bounds_large_ms":0.02},"status":"discard","description":"isLineBlocked wrapper to avoid coordinate unpacking. Regressed 2.89→3.48ms.","timestamp":1774736223098,"segment":0,"confidence":108.7578947368421,"iterationTokens":4656,"asi":{"hypothesis":"Add isLineBlocked wrapper to reuse Point objects","rollback_reason":"Extra method dispatch negates savings. V8 already optimizes Point object creation.","next_action_hint":"At 2.89ms (37x improvement), routing micro-opts are saturated. Try broader optimizations: renderer lookup map, memoized edge processing."}}
{"run":21,"commit":"42038ec","metric":3.17,"metrics":{"cycle_large_ms":1.99,"cycle_medium_ms":0.95,"cycle_small_ms":0.23,"route_large_ms":1.62,"route_medium_ms":1.55,"lookup_large_ms":5.47,"grid_dots_ms":0.06,"bounds_large_ms":0.01},"status":"keep","description":"Renderer Map for O(1) type lookups in useSolmu. Benchmark neutral (doesn't test React) but beneficial for real apps.","timestamp":1774736271989,"segment":0,"confidence":105.42857142857137,"iterationTokens":2651,"asi":{"hypothesis":"Replace config.renderers.find() with Map lookup for O(1) renderer resolution","finding":"Benchmark neutral since it doesn't test useSolmu's node rendering. But in real apps with many node types, this avoids O(n*m) where n=nodes, m=renderer types.","note":"Keeping because it's a genuine improvement for real applications even though benchmark can't measure it."}}
{"run":22,"commit":"0f1aef3","metric":3.53,"metrics":{"cycle_large_ms":2.4,"cycle_medium_ms":0.93,"cycle_small_ms":0.2,"route_large_ms":1.57,"route_medium_ms":1.55,"lookup_large_ms":5.16,"grid_dots_ms":0.06,"bounds_large_ms":0.01},"status":"keep","description":"Memoize nodeBoundsCache in useSolmu (was recomputed every render). Benchmark neutral but avoids spatial grid rebuild on state changes.","timestamp":1774736319477,"segment":0,"confidence":112.91803278688515,"iterationTokens":3639,"asi":{"hypothesis":"Memoize nodeBoundsCache to prevent unnecessary recomputation and spatial grid rebuild","finding":"Benchmark neutral (simulates per-render cost). In real React apps, this prevents the expensive getNodeBounds + createSpatialGrid from running when only selection/drag state changes - huge win for interactive performance.","note":"Primary metric appears worse (3.53 vs 2.89) but this is noise - the change doesn't affect the benchmark's measured code path."}}
{"run":23,"commit":"715204c","metric":2.91,"metrics":{"cycle_large_ms":1.64,"cycle_medium_ms":1.06,"cycle_small_ms":0.21,"route_large_ms":1.59,"route_medium_ms":0.75,"lookup_large_ms":5.12,"grid_dots_ms":0.06,"bounds_large_ms":0.01},"status":"keep","description":"Increase benchmark iterations to 11 for more stable measurements. 2.91ms with better noise reduction.","timestamp":1774736356334,"segment":0,"confidence":121.55294117647057,"iterationTokens":2426,"asi":{"hypothesis":"More benchmark iterations (11) for lower noise floor","finding":"2.91ms with better stability. The previous 2.89ms was likely a lucky run."}}
{"run":24,"commit":"1af625e","metric":2.9,"metrics":{"cycle_large_ms":1.65,"cycle_medium_ms":1.05,"cycle_small_ms":0.2,"route_large_ms":1.58,"route_medium_ms":0.75,"lookup_large_ms":5.14,"grid_dots_ms":0.08,"bounds_large_ms":0.01},"status":"keep","description":"Inline lineIntersectsRect: avoid expandedRect/corners array allocation. 2.91→2.90ms (neutral but cleaner code).","timestamp":1774736394141,"segment":0,"confidence":121.5529411764706,"iterationTokens":2845,"asi":{"hypothesis":"Inline rect expansion and unroll corner loop in lineIntersectsRect","finding":"Neutral performance. lineIntersectsRect is not on the hot path since most edges take the direct-path early exit. Still beneficial for correctness and reduced GC pressure when A* does run."}}
{"run":25,"commit":"1af625e","metric":2.94,"metrics":{"cycle_large_ms":1.68,"cycle_medium_ms":1.06,"cycle_small_ms":0.2,"route_large_ms":1.61,"route_medium_ms":0.84,"lookup_large_ms":5.11,"grid_dots_ms":0.06,"bounds_large_ms":0.02},"status":"discard","description":"Profile: grid_build=0.16ms, map=0.05ms, routing=1.45ms for 1740 edges. Cleaned up.","timestamp":1774736443268,"segment":0,"confidence":121.55294117647063,"iterationTokens":1858,"asi":{"hypothesis":"Profile breakdown of cycle_large costs","rollback_reason":"Profiling only, no code change to keep","finding":"For 900-node graph: grid_build=0.16ms, map_build=0.05ms, bounds=0.02ms. Remaining 1.45ms is pure edge routing at 0.83µs/edge. This is very close to theoretical minimum for JS."}}
